<?xml version="1.0" encoding="UTF-8"?>
<!DOCTYPE MintermFilter SYSTEM "../../../DTDs/filters.dtd">

<MintermFilter formatFile="../../../TM_Formats/Level2/asw_pus_tm_20_2_uint32_format.xml">
	<BoolVar id="0" name="N0" constantType="decimal">
		<FieldRef name="N" />
		<Op type="equal" />
		<Constant value="1" />
	</BoolVar>
	<BoolVar id="1" name="PID0" constantType="decimal">
		<FieldRef name="PID" />
		<Op type="equal" />
		<Constant value="10" />
	</BoolVar>
	<BoolVar id="2" name="PID0Value" constantType="decimal">
		<FieldRef name="PIDValue" />
		<Op type="equal" />
		<Constant value="99" />
	</BoolVar>
	<Minterm id="0">
		<BoolVarRef idRef="0" />
		<BoolVarRef idRef="1" />
		<BoolVarRef idRef="2" />
	</Minterm>
</MintermFilter>
