<?xml version="1.0" encoding="UTF-8" ?>
<!DOCTYPE MintermFilter SYSTEM "../../DTDs/filters.dtd">

<MintermFilter formatFile="../../TM_Formats/Level0/cssds_pus_v2_tm_format.xml">
	<BoolVar id="0" name="VersionIs2" constantType="decimal">
		<FieldRef name="VersionNumber" />
		<Op type="equal" />
		<Constant value="2" />
	</BoolVar>
	<BoolVar id="1" name="TypeIs0" constantType="decimal">
		<FieldRef name="Type" />
		<Op type="equal" />
		<Constant value="0" />
	</BoolVar>
	<Minterm id="0">
		<BoolVarRef idRef="0" />
		<BoolVarRef idRef="1" />
	</Minterm>
</MintermFilter>
