<?xml version="1.0" encoding="UTF-8"?>
<!DOCTYPE MintermFilter SYSTEM "../../../DTDs/filters.dtd">

<MintermFilter formatFile="../../TM_Formats/Level2/st06/asw_pus_tm_6_10_format.xml">
    <BoolVar id="0" name="memory_id_equal_to_0" constantType="hex">
		<FieldRef name="MemoryID" />
		<Op type="equal" />
		<Constant value="0" />
	</BoolVar>
	<BoolVar id="1" name="N_equal_to_1" constantType="hex">
		<FieldRef name="N" />
		<Op type="equal" />
		<Constant value="0x1" />
	</BoolVar>
	<BoolVar id="2" name="StartAddess_equal_to_0x90" constantType="hex">
		<FieldRef name="StartAddress" />
		<Op type="equal" />
		<Constant value="90" />
	</BoolVar>
	<BoolVar id="3" name="Length_equal_to_48" constantType="decimal">
		<FieldRef name="Length" />
		<Op type="equal" />
		<Constant value="48" />
	</BoolVar>
	<BoolVar id="4" name="ChecksumEqual" constantType="hex">
		<FieldRef name="Checksum" />
		<Op type="equal" />
		<Constant value="530A" />
	</BoolVar>
	<Minterm id="0">
		<BoolVarRef idRef="0" />
		<BoolVarRef idRef="1" />
		<BoolVarRef idRef="2" />
		<BoolVarRef idRef="3" />
		<BoolVarRef idRef="4" />
	</Minterm>
</MintermFilter>
