<?xml version="1.0" encoding="UTF-8"?>
<!DOCTYPE MintermFilter SYSTEM "../../../DTDs/filters.dtd">

<MintermFilter formatFile="../../TM_Formats/Level2/asw_pus_tm_4_2_format.xml">
	<BoolVar id="0" name="N" constantType="hex">
		<FieldRef name="N" />
		<Op type="equal" />
		<Constant value="0x1" />
	</BoolVar>
	<BoolVar id="1" name="PID" constantType="hex">
		<FieldRef name="PID" />
		<Op type="equal" />
		<Constant value="0x3" />
	</BoolVar>
	<Minterm id="0">
		<BoolVarRef idRef="0" />
		<BoolVarRef idRef="1" />
	</Minterm>
</MintermFilter>
